retro_game_id,year,month,day,st_fl,regseason_fl,playoff_fl,game_type,game_type_des,local_game_time,game_id,home_team_id,away_team_id,home_team_lg,away_team_lg,interleague_fl,park_id,park_name,park_location,inning_number,bat_home_id,outs_ct,pit_mlbid,pit_first_name,pit_last_name,pit_box_name,pit_hand_cd,bat_mlbid,bat_first_name,bat_last_name,bat_box_name,bat_hand_cd,ab_number,start_bases,end_bases,event_outs_ct,ab_des,event_tx,event_cd,hit_x,hit_y,event_num,home_team_runs,away_team_runs,ball_ct,strike_ct,pitch_seq,pitch_type_seq,battedball_cd
HOU201909100,2019,9,10,F,T,F,R,Regular Season,19:10,565679,hou,oak,AL,AL,F,2392,Minute Maid Park,"Houston, TX",4,0,0,607352,Joe,Biagini,Biagini,R,656305,Matt,Chapman,"Chapman, M",R,42,___,1__,0,Matt Chapman singles on a ground ball to left fielder Michael Brantley.,Single,20,85.43,122.76,29,2,15,1,2,SSSBX,FC|CU|FF|CU|FF,G
HOU201909100,2019,9,10,F,T,F,R,Regular Season,19:10,565679,hou,oak,AL,AL,F,2392,Minute Maid Park,"Houston, TX",4,0,0,607352,Joe,Biagini,Biagini,R,621566,Matt,Olson,Olson,L,43,1__,___,0,Matt Olson homers (31) on a fly ball to right field.    Matt Chapman scores.,Home Run,23,227.69,53.8,36,2,17,3,2,BBSSBX,CU|CH|FF|FF|FF|FF,F
HOU201909100,2019,9,10,F,T,F,R,Regular Season,19:10,565679,hou,oak,AL,AL,F,2392,Minute Maid Park,"Houston, TX",4,0,0,606965,Chris,Devenski,Devenski,R,592192,Mark,Canha,Canha,R,44,___,___,1,Mark Canha flies out to left fielder Michael Brantley.,Flyout,2,80.22,61.01,47,2,17,1,1,SBX,SL|SL|FF,F
HOU201909100,2019,9,10,F,T,F,R,Regular Season,19:10,565679,hou,oak,AL,AL,F,2392,Minute Maid Park,"Houston, TX",4,0,1,606965,Chris,Devenski,Devenski,R,640461,Chad,Pinder,Pinder,R,45,___,___,2,"Chad Pinder grounds out, shortstop Alex Bregman to first baseman Aledmys Diaz.",Groundout,2,113.88,159.84,52,2,17,1,1,SBX,FF|SL|CH,G
HOU201909100,2019,9,10,F,T,F,R,Regular Season,19:10,565679,hou,oak,AL,AL,F,2392,Minute Maid Park,"Houston, TX",4,0,2,606965,Chris,Devenski,Devenski,R,501981,Khris,Davis,"Davis, K",R,46,___,___,3,Khris Davis flies out to right fielder Josh Reddick.,Flyout,2,223.78,91.41,57,2,17,0,1,SX,SL|FF,F
HOU201909100,2019,9,10,F,T,F,R,Regular Season,19:10,565679,hou,oak,AL,AL,F,2392,Minute Maid Park,"Houston, TX",4,1,0,543699,Tanner,Roark,Roark,R,670541,Yordan,Alvarez,Alvarez,L,47,___,___,1,Yordan Alvarez lines out sharply to center fielder Mark Canha.,Lineout,2,149.39,50.35,61,2,17,2,1,BBSX,FT|FT|FF|FT,L
HOU201909100,2019,9,10,F,T,F,R,Regular Season,19:10,565679,hou,oak,AL,AL,F,2392,Minute Maid Park,"Houston, TX",4,1,1,543699,Tanner,Roark,Roark,R,649557,Aledmys,Diaz,"Díaz, A",R,48,___,___,2,Aledmys Diaz lines out sharply to left fielder Robbie Grossman.,Lineout,2,71.78,86.57,63,2,17,0,0,X,FF,L
HOU201909100,2019,9,10,F,T,F,R,Regular Season,19:10,565679,hou,oak,AL,AL,F,2392,Minute Maid Park,"Houston, TX",4,1,2,543699,Tanner,Roark,Roark,R,647351,Abraham,Toro,Toro,L,49,___,___,3,"Abraham Toro grounds out, shortstop Marcus Semien to first baseman Matt Olson.",Groundout,2,114.39,159.33,65,2,17,0,1,SX,CU|FF,G
HOU201909100,2019,9,10,F,T,F,R,Regular Season,19:10,565679,hou,oak,AL,AL,F,2392,Minute Maid Park,"Houston, TX",5,0,0,606965,Chris,Devenski,Devenski,R,595777,Jurickson,Profar,Profar,L,50,___,___,1,Jurickson Profar pops out to second baseman Aledmys Diaz in foul territory.,Pop Out,2,183.89,156.77,6,2,17,2,2,BBSSSX,CH|CH|CH|CH|SL|CH,P
HOU201909100,2019,9,10,F,T,F,R,Regular Season,19:10,565679,hou,oak,AL,AL,F,2392,Minute Maid Park,"Houston, TX",5,0,1,606965,Chris,Devenski,Devenski,R,669221,Sean,Murphy,"Murphy, S",R,51,___,___,1,Sean Murphy homers (3) on a line drive to left field.,Home Run,23,44.46,69.94,14,2,18,1,1,BSX,SL|SL|FF,L
HOU201909100,2019,9,10,F,T,F,R,Regular Season,19:10,565679,hou,oak,AL,AL,F,2392,Minute Maid Park,"Houston, TX",5,0,1,606965,Chris,Devenski,Devenski,R,543257,Robbie,Grossman,Grossman,L,52,___,1__,1,Robbie Grossman singles on a soft ground ball to third baseman Abraham Toro.,Single,20,120.48,174.57,19,2,18,0,0,X,CH,G
HOU201909100,2019,9,10,F,T,F,R,Regular Season,19:10,565679,hou,oak,AL,AL,F,2392,Minute Maid Park,"Houston, TX",5,0,1,606965,Chris,Devenski,Devenski,R,543760,Marcus,Semien,Semien,R,53,1_3,_23,1,Marcus Semien doubles (38) on a sharp line drive to right fielder Josh Reddick.   Robbie Grossman scores.,Double,21,173.97,46.17,22,2,19,0,1,SX,FF|FF,
HOU201909100,2019,9,10,F,T,F,R,Regular Season,19:10,565679,hou,oak,AL,AL,F,2392,Minute Maid Park,"Houston, TX",5,0,1,606965,Chris,Devenski,Devenski,R,656305,Matt,Chapman,"Chapman, M",R,54,___,___,2,Matt Chapman called out on strikes.,Strikeout,3,,,28,2,19,2,3,SBBSSS,SL|SL|SL|SL|CH|FF,
HOU201909100,2019,9,10,F,T,F,R,Regular Season,19:10,565679,hou,oak,AL,AL,F,2392,Minute Maid Park,"Houston, TX",5,0,2,606965,Chris,Devenski,Devenski,R,621566,Matt,Olson,Olson,L,55,___,___,3,Matt Olson flies out to left fielder Garrett Stubbs.,Flyout,2,69.26,72.33,36,2,19,2,2,SBBSSX,SL|CH|CH|CH|SL|FF,F
HOU201909100,2019,9,10,F,T,F,R,Regular Season,19:10,565679,hou,oak,AL,AL,F,2392,Minute Maid Park,"Houston, TX",5,1,0,543699,Tanner,Roark,Roark,R,455117,Martin,Maldonado,Maldonado,R,56,___,___,0,Martin Maldonado homers (10) on a fly ball to left center field.,Home Run,23,55.56,50.58,45,3,19,2,1,SBBX,SL|FF|FF|FF,F
HOU201909100,2019,9,10,F,T,F,R,Regular Season,19:10,565679,hou,oak,AL,AL,F,2392,Minute Maid Park,"Houston, TX",5,1,0,543699,Tanner,Roark,Roark,R,502210,Josh,Reddick,Reddick,L,57,___,1__,0,Josh Reddick singles on a line drive to left fielder Robbie Grossman.,Single,20,68.06,105.7,47,3,19,0,0,X,FT,L
HOU201909100,2019,9,10,F,T,F,R,Regular Season,19:10,565679,hou,oak,AL,AL,F,2392,Minute Maid Park,"Houston, TX",5,1,0,543699,Tanner,Roark,Roark,R,663656,Kyle,Tucker,Tucker,L,58,1__,___,2,"Kyle Tucker grounds into a double play, first baseman Matt Olson to third baseman Matt Chapman to first baseman Matt Olson.   Josh Reddick out at 2nd.    Kyle Tucker out at 1st.",Grounded Into DP,2,150.96,167.46,49,3,19,1,0,BX,FF|CH,G
HOU201909100,2019,9,10,F,T,F,R,Regular Season,19:10,565679,hou,oak,AL,AL,F,2392,Minute Maid Park,"Houston, TX",5,1,2,543699,Tanner,Roark,Roark,R,545350,Jake,Marisnick,Marisnick,R,59,___,___,3,Jake Marisnick flies out to center fielder Mark Canha.,Flyout,2,99.81,76.1,52,3,19,3,2,BSSBBSSSSX,SL|SL|FF|CU|FF|FF|FT|FF|FF|SL,F
HOU201909100,2019,9,10,F,T,F,R,Regular Season,19:10,565679,hou,oak,AL,AL,F,2392,Minute Maid Park,"Houston, TX",6,0,0,664285,Framber,Valdez,"Valdez, F",L,592192,Mark,Canha,Canha,R,60,___,1__,0,Mark Canha singles on a ground ball to right fielder Josh Reddick.,Single,20,161.63,118.7,5,3,19,0,1,SX,FT|FT,G
HOU201909100,2019,9,10,F,T,F,R,Regular Season,19:10,565679,hou,oak,AL,AL,F,2392,Minute Maid Park,"Houston, TX",6,0,0,664285,Framber,Valdez,"Valdez, F",L,640461,Chad,Pinder,Pinder,R,61,___,___,1,Chad Pinder strikes out swinging.,Strikeout,3,,,9,3,19,2,3,BSBSSSSS,FT|FT|FT|FT|CU|CU|FT|CU,
HOU201909100,2019,9,10,F,T,F,R,Regular Season,19:10,565679,hou,oak,AL,AL,F,2392,Minute Maid Park,"Houston, TX",6,0,1,664285,Framber,Valdez,"Valdez, F",L,501981,Khris,Davis,"Davis, K",R,62,12_,123,1,Khris Davis singles on a ground ball to right fielder Josh Reddick.   Mark Canha to 3rd.,Single,20,177.88,111.58,19,3,19,0,0,X,FT,G
HOU201909100,2019,9,10,F,T,F,R,Regular Season,19:10,565679,hou,oak,AL,AL,F,2392,Minute Maid Park,"Houston, TX",6,0,1,664285,Framber,Valdez,"Valdez, F",L,595777,Jurickson,Profar,Profar,R,63,__3,___,2,Jurickson Profar out on a sacrifice fly to center fielder Jake Marisnick.   Mark Canha scores.,Sac Fly,2,119.57,62.97,24,3,20,1,0,BX,FT|FT,F
HOU201909100,2019,9,10,F,T,F,R,Regular Season,19:10,565679,hou,oak,AL,AL,F,2392,Minute Maid Park,"Houston, TX",6,0,2,664285,Framber,Valdez,"Valdez, F",L,669221,Sean,Murphy,"Murphy, S",R,64,1__,1__,3,"Sean Murphy grounds into a force out, shortstop Myles Straw to second baseman Aledmys Diaz.   Khris Davis out at 2nd.",Forceout,2,113.88,153.24,29,3,20,1,0,BX,FT|FT,G
HOU201909100,2019,9,10,F,T,F,R,Regular Season,19:10,565679,hou,oak,AL,AL,F,2392,Minute Maid Park,"Houston, TX",6,1,0,543699,Tanner,Roark,Roark,R,596117,Garrett,Stubbs,Stubbs,L,65,___,_2_,0,Garrett Stubbs doubles (3) on a line drive to left fielder Robbie Grossman.,Double,21,60.78,56.73,36,3,20,1,2,SSBX,CH|CU|CU|FT,L
HOU201909100,2019,9,10,F,T,F,R,Regular Season,19:10,565679,hou,oak,AL,AL,F,2392,Minute Maid Park,"Houston, TX",6,1,0,543699,Tanner,Roark,Roark,R,664702,Myles,Straw,Straw,R,66,_2_,1__,0,Myles Straw singles on a ground ball to center fielder Mark Canha.   Garrett Stubbs scores.,Single,20,122.52,109.55,38,4,20,2,2,BSBSSX,SL|FT|FT|FF|CU|SL,G
HOU201909100,2019,9,10,F,T,F,R,Regular Season,19:10,565679,hou,oak,AL,AL,F,2392,Minute Maid Park,"Houston, TX",6,1,0,543699,Tanner,Roark,Roark,R,670541,Yordan,Alvarez,Alvarez,L,67,___,___,1,Yordan Alvarez strikes out on a foul tip.,Strikeout,3,,,41,4,20,1,3,BSSS,CH|CH|FF|SL,
HOU201909100,2019,9,10,F,T,F,R,Regular Season,19:10,565679,hou,oak,AL,AL,F,2392,Minute Maid Park,"Houston, TX",6,1,1,543699,Tanner,Roark,Roark,R,649557,Aledmys,Diaz,"Díaz, A",R,68,1__,_2_,2,"Aledmys Diaz grounds out, second baseman Jurickson Profar to first baseman Matt Olson.   Myles Straw to 2nd.",Groundout,2,144.41,160.58,43,4,20,1,1,BSX,FT|SL|SL,G
HOU201909100,2019,9,10,F,T,F,R,Regular Season,19:10,565679,hou,oak,AL,AL,F,2392,Minute Maid Park,"Houston, TX",6,1,2,543699,Tanner,Roark,Roark,R,647351,Abraham,Toro,Toro,L,69,_2_,1__,2,Abraham Toro singles on a fly ball to center fielder Mark Canha.   Myles Straw scores.,Single,20,114.64,107.87,46,5,20,1,1,SBX,CH|CH|FF,F
HOU201909100,2019,9,10,F,T,F,R,Regular Season,19:10,565679,hou,oak,AL,AL,F,2392,Minute Maid Park,"Houston, TX",6,1,2,488748,Ryan,Buchter,Buchter,L,455117,Martin,Maldonado,Maldonado,R,70,___,___,3,Martin Maldonado strikes out swinging.,Strikeout,3,,,51,5,20,0,3,SSS,CU|FC|FC,
HOU201909100,2019,9,10,F,T,F,R,Regular Season,19:10,565679,hou,oak,AL,AL,F,2392,Minute Maid Park,"Houston, TX",7,0,0,664285,Framber,Valdez,"Valdez, F",L,543257,Robbie,Grossman,Grossman,R,71,___,___,1,"Robbie Grossman grounds out, pitcher Framber Valdez to first baseman Martin Maldonado.",Groundout,2,124.55,184.22,1,5,20,2,1,SBBX,FT|FF|CU|FT,G
HOU201909100,2019,9,10,F,T,F,R,Regular Season,19:10,565679,hou,oak,AL,AL,F,2392,Minute Maid Park,"Houston, TX",7,0,1,664285,Framber,Valdez,"Valdez, F",L,620439,Franklin,Barreto,Barreto,R,72,___,___,2,Franklin Barreto flies out to center fielder Jake Marisnick.,Flyout,2,142.97,41.12,7,5,20,2,1,BBSX,CU|FF|FT|FT,F
HOU201909100,2019,9,10,F,T,F,R,Regular Season,19:10,565679,hou,oak,AL,AL,F,2392,Minute Maid Park,"Houston, TX",7,0,2,664285,Framber,Valdez,"Valdez, F",L,641914,Sheldon,Neuse,Neuse,R,73,___,___,3,Sheldon Neuse strikes out swinging.,Strikeout,3,,,13,5,20,0,3,SSS,CU|FT|CU,
HOU201909100,2019,9,10,F,T,F,R,Regular Season,19:10,565679,hou,oak,AL,AL,F,2392,Minute Maid Park,"Houston, TX",7,1,0,596043,Daniel,Mengden,Mengden,R,502210,Josh,Reddick,Reddick,L,74,___,___,1,Josh Reddick flies out to right fielder Chad Pinder.,Flyout,2,184.24,111.01,20,5,20,2,1,BBSX,FF|FT|FT|FT,F
HOU201909100,2019,9,10,F,T,F,R,Regular Season,19:10,565679,hou,oak,AL,AL,F,2392,Minute Maid Park,"Houston, TX",7,1,1,596043,Daniel,Mengden,Mengden,R,663656,Kyle,Tucker,Tucker,L,75,___,1__,1,Kyle Tucker singles on a line drive to right fielder Chad Pinder.,Single,20,165.26,97.28,22,5,20,0,0,X,CU,L
HOU201909100,2019,9,10,F,T,F,R,Regular Season,19:10,565679,hou,oak,AL,AL,F,2392,Minute Maid Park,"Houston, TX",7,1,1,596043,Daniel,Mengden,Mengden,R,545350,Jake,Marisnick,Marisnick,R,76,___,___,2,Jake Marisnick flies out to center fielder Mark Canha.,Flyout,2,137.79,88.04,24,5,20,0,0,X,FC,F
HOU201909100,2019,9,10,F,T,F,R,Regular Season,19:10,565679,hou,oak,AL,AL,F,2392,Minute Maid Park,"Houston, TX",7,1,2,596043,Daniel,Mengden,Mengden,R,596117,Garrett,Stubbs,Stubbs,L,77,___,___,3,Garrett Stubbs grounds out to first baseman Seth Brown.,Groundout,2,158.58,167.97,26,5,20,0,0,X,FT,G
HOU201909100,2019,9,10,F,T,F,R,Regular Season,19:10,565679,hou,oak,AL,AL,F,2392,Minute Maid Park,"Houston, TX",8,0,0,664285,Framber,Valdez,"Valdez, F",L,664913,Seth,Brown,Brown,L,78,___,___,1,"Seth Brown grounds out softly, shortstop Myles Straw to first baseman Martin Maldonado.",Groundout,2,138.77,167.97,1,5,20,0,0,X,FT,G
HOU201909100,2019,9,10,F,T,F,R,Regular Season,19:10,565679,hou,oak,AL,AL,F,2392,Minute Maid Park,"Houston, TX",8,0,1,664285,Framber,Valdez,"Valdez, F",L,592192,Mark,Canha,Canha,R,79,___,___,2,Mark Canha strikes out swinging.,Strikeout,3,,,4,5,20,1,3,BSSSS,CH|FT|CU|CU|CU,
HOU201909100,2019,9,10,F,T,F,R,Regular Season,19:10,565679,hou,oak,AL,AL,F,2392,Minute Maid Park,"Houston, TX",8,0,2,664285,Framber,Valdez,"Valdez, F",L,640461,Chad,Pinder,Pinder,R,80,___,1__,2,Chad Pinder singles on a line drive to left fielder Kyle Tucker.,Single,20,90.63,98.04,11,5,20,2,1,BSBX,CH|FT|FT|CU,L
HOU201909100,2019,9,10,F,T,F,R,Regular Season,19:10,565679,hou,oak,AL,AL,F,2392,Minute Maid Park,"Houston, TX",8,0,2,664285,Framber,Valdez,"Valdez, F",L,501981,Khris,Davis,"Davis, K",R,81,1__,1__,3,"Khris Davis grounds into a force out, shortstop Myles Straw to second baseman Aledmys Diaz.   Chad Pinder out at 2nd.",Forceout,2,114.39,155.78,17,5,20,0,2,SSX,FT|FT|FT,G
HOU201909100,2019,9,10,F,T,F,R,Regular Season,19:10,565679,hou,oak,AL,AL,F,2392,Minute Maid Park,"Houston, TX",8,1,0,596043,Daniel,Mengden,Mengden,R,664702,Myles,Straw,Straw,R,82,___,1__,0,Myles Straw walks.,Walk,14,,,24,5,20,4,1,BSBBB,FC|FF|CU|FT|FT,
HOU201909100,2019,9,10,F,T,F,R,Regular Season,19:10,565679,hou,oak,AL,AL,F,2392,Minute Maid Park,"Houston, TX",8,1,0,596043,Daniel,Mengden,Mengden,R,670541,Yordan,Alvarez,Alvarez,L,83,1__,12_,0,Yordan Alvarez walks.   Myles Straw to 2nd.,Walk,14,,,26,5,20,4,1,SBBBB,FF|FF|FF|CH|FC,
HOU201909100,2019,9,10,F,T,F,R,Regular Season,19:10,565679,hou,oak,AL,AL,F,2392,Minute Maid Park,"Houston, TX",8,1,0,596043,Daniel,Mengden,Mengden,R,649557,Aledmys,Diaz,"Díaz, A",R,84,12_,__3,2,"Aledmys Diaz grounds into a double play, shortstop Franklin Barreto to second baseman Jurickson Profar to first baseman Seth Brown.   Myles Straw to 3rd.    Yordan Alvarez out at 2nd.    Aledmys Diaz out at 1st.",Grounded Into DP,2,111.85,154.25,29,5,20,1,2,SSSBSX,FF|CH|FF|SL|FC|FT,G
HOU201909100,2019,9,10,F,T,F,R,Regular Season,19:10,565679,hou,oak,AL,AL,F,2392,Minute Maid Park,"Houston, TX",8,1,2,596043,Daniel,Mengden,Mengden,R,647351,Abraham,Toro,Toro,L,85,___,___,3,"Abraham Toro grounds out, second baseman Jurickson Profar to first baseman Seth Brown.",Groundout,2,146.39,149.68,33,5,20,2,2,BSSSBSX,FT|FT|FC|CU|FF|SL|SL,G
HOU201909100,2019,9,10,F,T,F,R,Regular Season,19:10,565679,hou,oak,AL,AL,F,2392,Minute Maid Park,"Houston, TX",9,0,0,664285,Framber,Valdez,"Valdez, F",L,595777,Jurickson,Profar,Profar,R,86,___,1__,0,Jurickson Profar walks.,Walk,14,,,1,5,20,4,2,SBSBBB,FF|FF|FT|CU|CU|CU,
HOU201909100,2019,9,10,F,T,F,R,Regular Season,19:10,565679,hou,oak,AL,AL,F,2392,Minute Maid Park,"Houston, TX",9,0,0,664285,Framber,Valdez,"Valdez, F",L,607333,Beau,Taylor,Taylor,L,87,1__,_2_,1,"Beau Taylor grounds out softly, shortstop Myles Straw to first baseman Martin Maldonado.   Jurickson Profar to 2nd.",Groundout,2,138.77,168.48,9,5,20,0,1,SX,FT|FT,G
HOU201909100,2019,9,10,F,T,F,R,Regular Season,19:10,565679,hou,oak,AL,AL,F,2392,Minute Maid Park,"Houston, TX",9,0,1,664285,Framber,Valdez,"Valdez, F",L,543257,Robbie,Grossman,Grossman,R,88,_2_,__3,2,"Robbie Grossman grounds out, shortstop Myles Straw to first baseman Martin Maldonado.   Jurickson Profar to 3rd.",Groundout,2,117.94,155.27,14,5,20,1,1,SBX,FT|FF|FT,G
HOU201909100,2019,9,10,F,T,F,R,Regular Season,19:10,565679,hou,oak,AL,AL,F,2392,Minute Maid Park,"Houston, TX",9,0,2,664285,Framber,Valdez,"Valdez, F",L,620439,Franklin,Barreto,Barreto,R,89,__3,1__,2,Franklin Barreto singles on a sharp line drive to right fielder Josh Reddick.   Jurickson Profar scores.,Single,20,177.65,85.96,20,5,21,1,0,BX,FT|FT,
HOU201909100,2019,9,10,F,T,F,R,Regular Season,19:10,565679,hou,oak,AL,AL,F,2392,Minute Maid Park,"Houston, TX",9,0,2,664285,Framber,Valdez,"Valdez, F",L,641914,Sheldon,Neuse,Neuse,R,90,___,___,3,"Sheldon Neuse grounds out, shortstop Myles Straw to first baseman Martin Maldonado.",Groundout,2,116.93,163.9,25,5,21,0,0,X,FF,G
HOU201909100,2019,9,10,F,T,F,R,Regular Season,19:10,565679,hou,oak,AL,AL,F,2392,Minute Maid Park,"Houston, TX",9,1,0,596043,Daniel,Mengden,Mengden,R,455117,Martin,Maldonado,Maldonado,R,91,___,___,0,Martin Maldonado homers (11) on a fly ball to left field.,Home Run,23,47.7,72.3,28,6,21,0,1,SX,FF|FF,F
HOU201909100,2019,9,10,F,T,F,R,Regular Season,19:10,565679,hou,oak,AL,AL,F,2392,Minute Maid Park,"Houston, TX",9,1,0,596043,Daniel,Mengden,Mengden,R,502210,Josh,Reddick,Reddick,L,92,___,_2_,0,Josh Reddick doubles (17) on a sharp ground ball to right fielder Chad Pinder.,Double,21,215.47,107.52,30,6,21,0,1,SX,FT|FC,G
HOU201909100,2019,9,10,F,T,F,R,Regular Season,19:10,565679,hou,oak,AL,AL,F,2392,Minute Maid Park,"Houston, TX",9,1,0,596043,Daniel,Mengden,Mengden,R,663656,Kyle,Tucker,Tucker,L,93,___,___,1,Kyle Tucker called out on strikes.,Strikeout,3,,,32,6,21,3,3,BBSBSS,FT|FC|FC|CH|FT|FT,
HOU201909100,2019,9,10,F,T,F,R,Regular Season,19:10,565679,hou,oak,AL,AL,F,2392,Minute Maid Park,"Houston, TX",9,1,1,596043,Daniel,Mengden,Mengden,R,545350,Jake,Marisnick,Marisnick,R,94,12_,1__,2,"Astros challenged (tag play), call on the field was upheld: Jake Marisnick singles on a sharp line drive to left fielder Robbie Grossman.   Josh Reddick scores.  Jake Marisnick out at 2nd on the throw, left fielder Robbie Grossman to second baseman Jurickson Profar.",Single,20,58.51,100.82,34,7,21,1,1,SBX,FF|CU|SL,
HOU201909100,2019,9,10,F,T,F,R,Regular Season,19:10,565679,hou,oak,AL,AL,F,2392,Minute Maid Park,"Houston, TX",9,1,2,596043,Daniel,Mengden,Mengden,R,596117,Garrett,Stubbs,Stubbs,L,95,___,___,3,Garrett Stubbs pops out to third baseman Sheldon Neuse.,Pop Out,2,126.07,167.46,38,7,21,2,0,BBX,FT|FT|FT,P
SFN201909100,2019,9,10,F,T,F,R,Regular Season,18:45,566540,sfn,pit,NL,NL,F,2395,Oracle Park,"San Francisco, CA",1,0,0,456501,Johnny,Cueto,Cueto,R,621028,Kevin,Newman,Newman,R,1,___,___,1,"Kevin Newman grounds out, shortstop Brandon Crawford to first baseman Brandon Belt.",Groundout,2,113.61,142.61,1,0,0,0,2,SSX,FF|FT|SL,G
SFN201909100,2019,9,10,F,T,F,R,Regular Season,18:45,566540,sfn,pit,NL,NL,F,2395,Oracle Park,"San Francisco, CA",1,0,1,456501,Johnny,Cueto,Cueto,R,668804,Bryan,Reynolds,"Reynolds, B",L,2,___,___,2,Bryan Reynolds strikes out swinging.,Strikeout,3,,,6,0,0,2,3,SBSBS,SL|FT|CH|SL|SL,
SFN201909100,2019,9,10,F,T,F,R,Regular Season,18:45,566540,sfn,pit,NL,NL,F,2395,Oracle Park,"San Francisco, CA",1,0,2,456501,Johnny,Cueto,Cueto,R,592567,Colin,Moran,Moran,L,3,___,___,3,"Colin Moran grounds out softly, pitcher Johnny Cueto to first baseman Brandon Belt.",Groundout,2,128.81,186.97,13,0,0,2,0,BBX,FF|CH|SL,G
SFN201909100,2019,9,10,F,T,F,R,Regular Season,18:45,566540,sfn,pit,NL,NL,F,2395,Oracle Park,"San Francisco, CA",1,1,0,656605,Mitch,Keller,Keller,R,643289,Mauricio,Dubon,Dubón,R,4,___,1__,0,Mauricio Dubon singles on a ground ball to right fielder Jose Osuna.,Single,20,160.12,111.34,18,0,0,1,1,SBX,FF|FF|CU,G
SFN201909100,2019,9,10,F,T,F,R,Regular Season,18:45,566540,sfn,pit,NL,NL,F,2395,Oracle Park,"San Francisco, CA",1,1,0,656605,Mitch,Keller,Keller,R,474832,Brandon,Belt,Belt,L,5,1__,_23,0,Brandon Belt doubles (27) on a fly ball to right fielder Jose Osuna.   Mauricio Dubon to 3rd.,Double,21,215.18,105.3,20,0,0,1,0,BX,FF|CH,F
SFN201909100,2019,9,10,F,T,F,R,Regular Season,18:45,566540,sfn,pit,NL,NL,F,2395,Oracle Park,"San Francisco, CA",1,1,0,656605,Mitch,Keller,Keller,R,446334,Evan,Longoria,Longoria,R,6,___,___,1,Evan Longoria strikes out swinging.,Strikeout,3,,,23,0,0,2,3,BSBSS,FF|FF|FF|CU|SL,
SFN201909100,2019,9,10,F,T,F,R,Regular Season,18:45,566540,sfn,pit,NL,NL,F,2395,Oracle Park,"San Francisco, CA",1,1,1,656605,Mitch,Keller,Keller,R,519390,Stephen,Vogt,Vogt,L,7,_23,1__,1,Stephen Vogt singles on a line drive to right fielder Jose Osuna.   Mauricio Dubon scores.    Brandon Belt scores.,Single,20,146.16,99.4,25,2,0,0,2,SSSX,FF|FF|FF|SL,L
SFN201909100,2019,9,10,F,T,F,R,Regular Season,18:45,566540,sfn,pit,NL,NL,F,2395,Oracle Park,"San Francisco, CA",1,1,1,656605,Mitch,Keller,Keller,R,607680,Kevin,Pillar,Pillar,R,8,1__,12_,1,Kevin Pillar singles on a ground ball to left fielder Kevin Kramer.   Stephen Vogt to 2nd.,Single,20,82.17,116.11,29,2,0,0,2,SSX,SL|FF|SL,G
SFN201909100,2019,9,10,F,T,F,R,Regular Season,18:45,566540,sfn,pit,NL,NL,F,2395,Oracle Park,"San Francisco, CA",1,1,1,656605,Mitch,Keller,Keller,R,543063,Brandon,Crawford,Crawford,L,9,123,123,1,Brandon Crawford singles on a ground ball to left fielder Kevin Kramer.   Stephen Vogt scores.    Kevin Pillar to 3rd.,Single,20,90.05,113.08,33,3,0,0,2,SSSX,FF|FF|FF|FF,G
SFN201909100,2019,9,10,F,T,F,R,Regular Season,18:45,566540,sfn,pit,NL,NL,F,2395,Oracle Park,"San Francisco, CA",1,1,1,656605,Mitch,Keller,Keller,R,664041,Jaylin,Davis,"Davis, J",R,10,1__,___,3,"Jaylin Davis grounds into a double play, shortstop Kevin Newman to second baseman Adam Frazier to first baseman Josh Bell.   Brandon Crawford out at 2nd.    Jaylin Davis out at 1st.",Grounded Into DP,2,111.85,148.21,39,3,0,1,2,BSSSX,SL|FF|FF|CU|SL,G
SFN201909100,2019,9,10,F,T,F,R,Regular Season,18:45,566540,sfn,pit,NL,NL,F,2395,Oracle Park,"San Francisco, CA",2,0,0,456501,Johnny,Cueto,Cueto,R,605137,Josh,Bell,Bell,L,11,___,___,1,"Josh Bell grounds out softly, third baseman Evan Longoria to first baseman Brandon Belt.",Groundout,2,141.04,168.75,1,3,0,3,2,BSSBBSX,FF|SL|CH|CH|SL|CH|FF,G
SFN201909100,2019,9,10,F,T,F,R,Regular Season,18:45,566540,sfn,pit,NL,NL,F,2395,Oracle Park,"San Francisco, CA",2,0,1,456501,Johnny,Cueto,Cueto,R,591741,Jose,Osuna,Osuna,R,12,___,___,2,Jose Osuna called out on strikes.,Strikeout,3,,,10,3,0,2,3,SBSBSSS,SL|FT|CH|SL|FF|FF|FF,
SFN201909100,2019,9,10,F,T,F,R,Regular Season,18:45,566540,sfn,pit,NL,NL,F,2395,Oracle Park,"San Francisco, CA",2,0,2,456501,Johnny,Cueto,Cueto,R,624428,Adam,Frazier,"Frazier, A",L,13,___,___,3,Adam Frazier flies out to left fielder Austin Slater.,Flyout,2,85.1,101.9,19,3,0,1,2,BSSX,CH|SL|FF|SL,F
SFN201909100,2019,9,10,F,T,F,R,Regular Season,18:45,566540,sfn,pit,NL,NL,F,2395,Oracle Park,"San Francisco, CA",2,1,0,656605,Mitch,Keller,Keller,R,596103,Austin,Slater,Slater,R,14,___,___,1,"Austin Slater grounds out softly, second baseman Adam Frazier to first baseman Josh Bell.",Groundout,2,145.16117903327023,155.47651806229132,25,3,0,1,2,SSBX,FF|FF|FF|CU,G
SFN201909100,2019,9,10,F,T,F,R,Regular Season,18:45,566540,sfn,pit,NL,NL,F,2395,Oracle Park,"San Francisco, CA",2,1,1,656605,Mitch,Keller,Keller,R,456501,Johnny,Cueto,Cueto,R,15,___,___,2,Johnny Cueto strikes out on a foul bunt.,Strikeout,3,,,27,3,0,1,3,BSSSS,FF|FF|SL|FF|CU,
SFN201909100,2019,9,10,F,T,F,R,Regular Season,18:45,566540,sfn,pit,NL,NL,F,2395,Oracle Park,"San Francisco, CA",2,1,2,656605,Mitch,Keller,Keller,R,643289,Mauricio,Dubon,Dubón,R,16,___,_2_,2,Mauricio Dubon doubles (3) on a ground ball to right fielder Jose Osuna.,Double,21,200.88,123.38,29,3,0,2,2,SBSBX,FF|FF|FF|FF|FF,G
SFN201909100,2019,9,10,F,T,F,R,Regular Season,18:45,566540,sfn,pit,NL,NL,F,2395,Oracle Park,"San Francisco, CA",2,1,2,656605,Mitch,Keller,Keller,R,474832,Brandon,Belt,Belt,L,17,___,___,3,Brandon Belt strikes out on a foul tip.,Strikeout,3,,,31,3,0,1,3,BSSS,FF|FF|FF|FF,
SFN201909100,2019,9,10,F,T,F,R,Regular Season,18:45,566540,sfn,pit,NL,NL,F,2395,Oracle Park,"San Francisco, CA",3,0,0,456501,Johnny,Cueto,Cueto,R,607732,Jacob,Stallings,Stallings,R,18,___,___,1,"Jacob Stallings grounds out, second baseman Mauricio Dubon to first baseman Brandon Belt.",Groundout,2,151.22,147.6,1,3,0,0,0,X,FT,G
SFN201909100,2019,9,10,F,T,F,R,Regular Season,18:45,566540,sfn,pit,NL,NL,F,2395,Oracle Park,"San Francisco, CA",3,0,1,456501,Johnny,Cueto,Cueto,R,596012,Kevin,Kramer,Kramer,L,19,___,1__,1,Kevin Kramer singles on a line drive to right fielder Jaylin Davis.,Single,20,160.67,94.39,4,3,0,1,1,SBX,FT|CH|CH,L
SFN201909100,2019,9,10,F,T,F,R,Regular Season,18:45,566540,sfn,pit,NL,NL,F,2395,Oracle Park,"San Francisco, CA",3,0,1,456501,Johnny,Cueto,Cueto,R,656605,Mitch,Keller,Keller,R,20,1__,_2_,2,Mitch Keller out on a sacrifice bunt to first baseman Brandon Belt.   Kevin Kramer to 2nd.,Sac Bunt,2,134.86,188.79,9,3,0,1,0,BX,FF|SL,G
SFN201909100,2019,9,10,F,T,F,R,Regular Season,18:45,566540,sfn,pit,NL,NL,F,2395,Oracle Park,"San Francisco, CA",3,0,2,456501,Johnny,Cueto,Cueto,R,621028,Kevin,Newman,Newman,R,21,___,1__,2,Kevin Newman walks.,Walk,14,,,15,3,0,4,0,BBBB,FT|SL|SL|FF,
SFN201909100,2019,9,10,F,T,F,R,Regular Season,18:45,566540,sfn,pit,NL,NL,F,2395,Oracle Park,"San Francisco, CA",3,0,2,456501,Johnny,Cueto,Cueto,R,668804,Bryan,Reynolds,"Reynolds, B",L,22,___,___,3,Bryan Reynolds grounds out to first baseman Brandon Belt.,Groundout,2,153.03,165.17,21,3,0,2,2,SBSBX,CH|SL|CH|FT|FT,G
SFN201909100,2019,9,10,F,T,F,R,Regular Season,18:45,566540,sfn,pit,NL,NL,F,2395,Oracle Park,"San Francisco, CA",3,1,0,656605,Mitch,Keller,Keller,R,446334,Evan,Longoria,Longoria,R,23,___,___,1,"Evan Longoria grounds out, shortstop Kevin Newman to first baseman Josh Bell.",Groundout,2,106.4,147.6,28,3,0,1,2,SBSX,CU|CU|FF|SL,G
SFN201909100,2019,9,10,F,T,F,R,Regular Season,18:45,566540,sfn,pit,NL,NL,F,2395,Oracle Park,"San Francisco, CA",3,1,1,656605,Mitch,Keller,Keller,R,519390,Stephen,Vogt,Vogt,L,24,___,___,2,Stephen Vogt strikes out swinging.,Strikeout,3,,,30,3,0,2,3,BBSSS,FF|CU|FF|FF|FF,
SFN201909100,2019,9,10,F,T,F,R,Regular Season,18:45,566540,sfn,pit,NL,NL,F,2395,Oracle Park,"San Francisco, CA",3,1,2,656605,Mitch,Keller,Keller,R,607680,Kevin,Pillar,Pillar,R,25,___,1__,2,Kevin Pillar singles on a fly ball to center fielder Bryan Reynolds.,Single,20,126.97,105.73,32,3,0,0,1,SX,CU|SL,F
